text,is_relevant
Does the late policy apply to the programming exercise?,1
What does the syllabus say about the TA office hours?,1
Can we compare precision and NumPy for the assignment?,1
How do I solve a homework problem about parallel programming?,0
How are PCA and curse of dimensionality connected?,1
Is C pointers covered in this class?,0
When should we choose PCA instead of curse of dimensionality?,1
Is anyone watching weather tonight?,0
Does the late policy apply to the TA office hours?,1
How are linear regression and perceptron connected?,1
Can someone send me the notes for organic chemistry?,0
Can we compare logistic regression and perceptron for the assignment?,1
Can we compare unsupervised learning and logistic regression for the assignment?,1
Quick question: can someone help me move my couch?,0
I forgot my umbrella today. Thanks.,0
discount code number 2 please ignore the lecture,0
follow my account number 9 please ignore the lecture,0
How do I solve a homework problem about European tragedies?,0
Can someone sell me basketball tickets?,0
What is the difference between optimization and generalization error?,1
What is the best place near campus for phone chargers?,0
I am confused about how dimensionality reduction works.,1
This chat should talk more about the dining hall menu.,0
Does anyone want to play FIFA later?,0
What is the difference between neural networks and objective functions?,1
How are PCA and nonlinear mapping connected?,1
Where can I buy basketball near campus?,0
Will precision appear in the assignment?,1
Can someone give an example of feature normalization?,1
What did we mean by nonlinear mapping in class today?,1
buy my used bike number 29 please ignore the lecture,0
Will optimization appear in the assignment?,1
Is anyone watching stock picks tonight?,0
What does the syllabus say about the assignment?,1
When should we choose training data instead of validation set?,1
Can I ask about clustering during office hours?,1
What does the syllabus say about the ULA office hours?,1
How does generalization error help with nonlinear data?,1
crypto giveaway number 24 please ignore the lecture,0
Can we compare machine learning and perceptron for the assignment?,1
subscribe to my channel number 14 please ignore the lecture,0
limited offer number 22 please ignore the lecture,0
Can I use Python for my C pointers assignment?,0
Can someone give an example of ridge regression?,1
Can someone explain the main idea of Kubernetes?,0
What is the difference between stochastic gradient descent and optimization?,1
Quick question: is anyone going out this weekend?,0
What is the difference between nonlinear mapping and loss functions?,1
Is anyone watching Taylor Swift tonight?,0
"For the code submission, do we need to include the part that computes momentum?",1
Can we talk about weather instead?,0
follow my account number 21 please ignore the lecture,0
Can someone explain the main idea of Docker containers?,0
Can we compare BERT embeddings and NumPy for the assignment?,1
discount code number 24 please ignore the lecture,0
Do we need to submit a README with the programming exercise?,1
Does anyone have recommendations for weather?,0
Can we compare curse of dimensionality and testing data for the assignment?,1
What is the difference between regression and perceptron?,1
How does Python help with nonlinear data?,1
Can someone send me the notes for recursion?,0
Why is embeddings important in machine learning?,1
Can the TA explain data structures during recitation?,0
What is the objective function for logistic regression?,1
"For the final report, should we discuss alternating optimization in the methodology section?",1
Can we attend any discussion section for help with the ULA office hours?,1
Is constitutional law covered in this class?,0
How are gradient descent and generalization error connected?,1
What does the syllabus say about the regrade request?,1
How should we evaluate a model that uses embeddings?,1
Is operating systems useful for software engineering interviews?,0
crypto giveaway number 20 please ignore the lecture,0
Can I submit the programming exercise late?,1
How does linear regression relate to the final project?,1
Why does linear regression reduce overfitting?,1
Can we make a group chat for FIFA?,0
Can someone send me the notes for Docker containers?,0
"Unrelated, but what is the best way to get to the airport?",0
Can someone give an example of Python?,1
Why is bias variance tradeoff important in machine learning?,1
subscribe to my channel number 12 please ignore the lecture,0
Is the French Revolution useful for software engineering interviews?,0
Does anyone want to form a study group for database joins?,0
How do I solve a homework problem about Docker containers?,0
Can someone sell me concert tickets tickets?,0
How much is the discussion section worth in the final grade?,1
What assumptions are we making when using curse of dimensionality?,1
Can we compare nonlinear mapping and objective functions for the assignment?,1
How are momentum and ridge regression connected?,1
When should we choose stochastic gradient descent instead of regularization?,1
What is the best place near campus for video games?,0
Can we talk about Netflix instead?,0
Can someone help me debug my graph theory project?,0
Can I ask about nonlinear mapping during office hours?,1
Is anyone watching concert tickets tonight?,0
Can someone explain the main idea of compiler design?,0
Can I ask about unsupervised learning during office hours?,1
What is the difference between linear regression and stochastic gradient descent?,1
Where can I find information about the assignment?,1
Quick question: can someone recommend a good TV show?,0
click this link number 9 please ignore the lecture,0
Can we use stochastic gradient descent in our project?,1
Is Spanish grammar covered in this class?,0
Does the assignment require us to understand discrete mathematics?,0
Can we make a group chat for campus gossip?,0
What is the best place near campus for fantasy football?,0
Can someone sell me fantasy football tickets?,0
Where is Ruxiao Duan's office hour?,1
Is supervised learning covered on the next quiz?,1
Can we compare machine learning and regression for the assignment?,1
Can someone send me the notes for game theory?,0
"Unrelated, but i found a jacket in the hallway.",0
Does anyone have a textbook for Git workflows?,0
When should we choose kernel methods instead of support vector machines?,1
sell me tickets number 26 please ignore the lecture,0
Does anyone want to talk about dorm decorations?,0
How does logistic regression help with nonlinear data?,1
discount code number 0 please ignore the lecture,0
What is the best place near campus for dorm decorations?,0
How hard is the midterm for Git workflows?,0
Can I use Python for my discrete mathematics assignment?,0
Can someone share notes about tax filing?,0
Can someone give an example of bias variance tradeoff?,1
limited offer number 12 please ignore the lecture,0
How does NumPy affect model performance?,1
What is the difference between classification and gradient descent?,1
Is lecture held in AKW 2nd Floor today?,1
Will Spanish grammar be on the quiz?,0
What is the best place near campus for weather?,0
Does anyone know a discount code for football?,0
Where can I buy Netflix near campus?,0
Where can I buy shopping near campus?,0
How does BERT embeddings relate to the final project?,1
Does anyone want to talk about campus gossip?,0
Is there a Piazza or Ed board for tax filing?,0
When should we choose feature normalization instead of training data?,1
I need a haircut recommendation. Thanks.,0
What is the difference between objective functions and bias variance tradeoff?,1
Can someone give an example of accuracy?,1
What is the difference between supervised learning and unsupervised learning?,1
Can we compare NumPy and scikit-learn for the assignment?,1
Does anyone want to talk about cheap sunglasses?,0
Where can I buy flight prices near campus?,0
Can someone send me the party address? Thanks.,0
Can I ask about embeddings during office hours?,1
Is linear algebra proofs covered in this class?,0
discount code number 3 please ignore the lecture,0
I have an extra ticket for FIFA.,0
sell me tickets number 22 please ignore the lecture,0
Can someone explain the main idea of Shakespeare?,0
Does anyone have a textbook for Ecuadorian history?,0
When should we choose recall instead of embeddings?,1
Can we use recall in our project?,1
How does stochastic gradient descent affect model performance?,1
Does anyone want to play vacation plans later?,0
Where can I find readings about C pointers?,0
cheap sunglasses number 14 please ignore the lecture,0
How are stochastic gradient descent and generalization error connected?,1
click this link number 20 please ignore the lecture,0
Does anyone want to form a study group for operating systems?,0
How do I solve a homework problem about constitutional law?,0
How should we evaluate a model that uses loss functions?,1
What is the best way to study React components?,0
What is the difference between logistic regression and momentum?,1
"For the final report, should we discuss loss functions in the methodology section?",1
Can we compare accuracy and BERT embeddings for the assignment?,1
Can someone explain the main idea of microeconomics?,0
What is the best place near campus for car repairs?,0
Does anyone have a textbook for public speaking?,0
How are ridge regression and PCA connected?,1
Is there a Piazza or Ed board for compiler design?,0
Quick question: can someone send me the party address?,0
Does anyone want to talk about video games?,0
Is gradient descent covered on the next quiz?,1
Is Ecuadorian history useful for software engineering interviews?,0
Are Mary Xie's office hours a good place to ask about the README?,1
Why does regularization reduce overfitting?,1
Can we compare neural networks and loss functions for the assignment?,1
Why is NumPy important in machine learning?,1
What is the difference between clustering and feature normalization?,1
"Unrelated, but can someone send me the party address?",0
What professor teaches Timsort next semester?,0
Does anyone have recommendations for campus gossip?,0
When should we choose stochastic gradient descent instead of optimization?,1
Can we ask questions about the ULA office hours on Ed Discussion?,1
Where can I find readings about React components?,0
What is the difference between nonlinear mapping and training data?,1
Can someone help me debug my Ecuadorian history project?,0
Can I submit a question about European tragedies here?,0
How are bias variance tradeoff and embeddings connected?,1
I have an extra ticket for airport rides.,0
When should we choose confusion matrix instead of precision?,1
sell me tickets number 29 please ignore the lecture,0
Does anyone have a textbook for linear algebra proofs?,0
Why is overfitting important in machine learning?,1
Can I submit a question about C pointers here?,0
Can someone share notes about Spanish grammar?,0
Does the late policy apply to the discussion section?,1
Can someone explain the main idea of the French Revolution?,0
How are classification and regression connected?,1
What did we mean by cross validation in class today?,1
Does anyone know a discount code for club meetings?,0
"For the code submission, do we need to include the part that computes cross validation?",1
"For the final report, should we discuss testing data in the methodology section?",1
"For the final report, should we discuss feature normalization in the methodology section?",1
Why is nonlinear mapping important in machine learning?,1
Can we compare logistic regression and momentum for the assignment?,1
Can we compare clustering and curse of dimensionality for the assignment?,1
buy my used bike number 6 please ignore the lecture,0
How do we optimize the weights when using regression?,1
What is the intuition behind logistic regression?,1
Why is ridge regression important in machine learning?,1
What did we mean by neural networks in class today?,1
What professor teaches operating systems next semester?,0
Can we compare support vector machines and PCA for the assignment?,1
What is the best place near campus for haircuts?,0
Can you explain kernel methods from lecture again?,1
Why is optimization important in machine learning?,1
Can we compare logistic regression and gradient descent for the assignment?,1
Does anyone want to talk about the NBA playoffs?,0
Can we use neural networks in our project?,1
What professor teaches recursion next semester?,0
Can we make a group chat for roommate drama?,0
Does anyone want to form a study group for European tragedies?,0
Can someone share notes about salsa music history?,0
How should we evaluate a model that uses generalization error?,1
Does anyone have a textbook for distributed systems?,0
What is the difference between dimensionality reduction and curse of dimensionality?,1
Can someone sell me car repairs tickets?,0
Can I submit a question about recursion here?,0
Can I use office hours to ask about European tragedies?,0
Does anyone have a textbook for Linux commands?,0
Can we compare regression and logistic regression for the assignment?,1
How does objective functions relate to the final project?,1
follow my account number 18 please ignore the lecture,0
Can we make a group chat for crypto prices?,0
Does anyone want to form a study group for C pointers?,0
How much is the quiz worth in the final grade?,1
Does anyone want to play airport rides later?,0
Can someone give an example of unsupervised learning?,1
Can the TA review linear regression in recitation?,1
I have an extra ticket for dating advice.,0
Can the TA explain compiler design during recitation?,0
How hard is the midterm for Docker containers?,0
How are loss functions and confusion matrix connected?,1
How much is the ULA office hours worth in the final grade?,1
How are logistic regression and gradient descent connected?,1
Are the TA's office hours a good place to ask about the final report?,1
How should we evaluate a model that uses alternating optimization?,1
Can we use momentum in our project?,1
What is the difference between embeddings and SciPy?,1
Can we talk about fantasy football instead?,0
sell me tickets number 3 please ignore the lecture,0
Can someone give an example of perceptron?,1
What is the difference between loss functions and cross validation?,1
Can we compare testing data and confusion matrix for the assignment?,1
What is the objective function for SVMs?,1
Why is gradient descent important in machine learning?,1
How are precision and logistic regression classifier connected?,1
Can I use Python for my Docker containers assignment?,0
Does the assignment require us to understand C pointers?,0
What is the difference between support vector machines and dimensionality reduction?,1
Can someone share notes about the French Revolution?,0
click this link number 10 please ignore the lecture,0
discount code number 8 please ignore the lecture,0
Can someone explain the main idea of linear algebra proofs?,0
Where can I find readings about the French Revolution?,0
subscribe to my channel number 10 please ignore the lecture,0
Can I submit a question about salsa music history here?,0
Does the assignment require us to understand graph theory?,0
Can I ask about alternating optimization during office hours?,1
What is the difference between testing data and confusion matrix?,1
Does anyone know a discount code for Taylor Swift?,0
"For the code submission, do we need to include the part that computes embeddings?",1
What is the difference between optimization and alternating optimization?,1
Can someone help me debug my Git workflows project?,0
Can someone share notes about discrete mathematics?,0
"For the final report, should we discuss bias variance tradeoff in the methodology section?",1
How do I solve a homework problem about Git workflows?,0
cheap sunglasses number 22 please ignore the lecture,0
What is the difference between cross validation and F1 score?,1
Can we compare recall and NumPy for the assignment?,1
Can I submit a question about Ecuadorian history here?,0
When is the discussion section due?,1
When should we choose supervised learning instead of regression?,1
"Unrelated, but free money click this link now.",0
subscribe to my channel number 9 please ignore the lecture,0
What is the difference between machine learning and supervised learning?,1
What is the best way to study Shakespeare?,0
What is the difference between objective functions and training data?,1
"Unrelated, but why is everyone talking about homework?",0
Is Kubernetes useful for software engineering interviews?,0
Can we make a group chat for flight prices?,0
free money number 11 please ignore the lecture,0
Does anyone know a discount code for restaurant recommendations?,0
limited offer number 28 please ignore the lecture,0
How are curse of dimensionality and training data connected?,1
Does anyone want to talk about vacation plans?,0
When should we choose alternating optimization instead of overfitting?,1
What professor teaches real analysis next semester?,0
How do I implement classification in Python?,1
Can we compare linear regression and momentum for the assignment?,1
Can I use office hours to ask about distributed systems?,0
What did we mean by unsupervised learning in class today?,1
Will parallel programming be on the quiz?,0
Can someone sell me weather tickets?,0
What professor teaches parallel programming next semester?,0
What is the best place near campus for the NBA playoffs?,0
Can we attend any discussion section for help with the late policy?,1
What is the difference between stochastic gradient descent and alternating optimization?,1
Can you explain BERT embeddings from lecture again?,1
How are validation set and F1 score connected?,1
What is the best place near campus for dating advice?,0
I have an extra ticket for phone chargers.,0
Does anyone have recommendations for movie recommendations?,0
Is there a Piazza or Ed board for Git workflows?,0
Can we compare neural networks and training data for the assignment?,1
Can someone sell me weekend plans tickets?,0
How are generalization error and support vector machines connected?,1
How should we evaluate a model that uses supervised learning?,1
Does anyone want to play dorm decorations later?,0
Is Git workflows covered in this class?,0
Can someone send me the party address?,0
What is the difference between precision and recall?,1
Can I use office hours to ask about microeconomics?,0
discount code number 20 please ignore the lecture,0
Can someone share notes about distributed systems?,0
"For the final report, should we discuss neural networks in the methodology section?",1
Can I submit a question about microeconomics here?,0
limited offer number 16 please ignore the lecture,0
Can we use clustering in our project?,1
What is the intuition behind objective functions?,1
What is your favorite color? Thanks.,0
What is the difference between validation set and precision?,1
Can someone help me debug my salsa music history project?,0
Where can I buy cheap sunglasses near campus?,0
Does the assignment require us to understand linear algebra proofs?,0
Can I ask about support vector machines during office hours?,1
Does anyone know a discount code for shopping?,0
Does anyone want to form a study group for salsa music history?,0
What is the difference between generalization error and kernel methods?,1
Can we compare supervised learning and gradient descent for the assignment?,1
What is the difference between precision and F1 score?,1
cheap sunglasses number 12 please ignore the lecture,0
Why is dimensionality reduction important in machine learning?,1
Does anyone have recommendations for dorm decorations?,0
Can someone help me debug my Spanish literature project?,0
How do we optimize the weights when using machine learning?,1
Does anyone have recommendations for Taylor Swift?,0
Can the TA explain Docker containers during recitation?,0
What is the difference between clustering and training data?,1
Can we compare logistic regression classifier and NumPy for the assignment?,1
Can someone help me debug my constitutional law project?,0
Can someone help me debug my Spanish grammar project?,0
Does anyone have recommendations for restaurant recommendations?,0
What is the difference between regularization and SVMs?,1
How are machine learning and supervised learning connected?,1
How does recall help with nonlinear data?,1
Is there a Piazza or Ed board for distributed systems?,0
Is lecture held in Davies Auditorium today?,1
Does the late policy apply to the extra credit?,1
Are Zhaoyang Zhang's office hours a good place to ask about the TA office hours?,1
Why is logistic regression important in machine learning?,1
Can I ask about bias variance tradeoff during office hours?,1
How does logistic regression relate to the final project?,1
How are cross validation and confusion matrix connected?,1
Does anyone have a textbook for Spanish literature?,0
Is visa paperwork covered in this class?,0
crypto giveaway number 21 please ignore the lecture,0
What did we mean by PCA in class today?,1
When should we choose feature normalization instead of objective functions?,1
How are gradient descent and stochastic gradient descent connected?,1
cheap sunglasses number 15 please ignore the lecture,0
limited offer number 3 please ignore the lecture,0
What assumptions are we making when using generalization error?,1
How hard is the midterm for computer architecture?,0
sell me tickets number 14 please ignore the lecture,0
This chat should talk more about campus gossip.,0
Who won summer housing yesterday?,0
Will the programming exercise be written in Python?,1
Will confusion matrix appear in the assignment?,1
Can we make a group chat for video games?,0
Can we compare unsupervised learning and perceptron for the assignment?,1
"For the code submission, do we need to include the part that computes regularization?",1
How does stochastic gradient descent relate to the final project?,1
Can we compare loss functions and objective functions for the assignment?,1
Can someone sell me phone chargers tickets?,0
Can someone explain the main idea of organic chemistry?,0
Will neural networks appear in the assignment?,1
Can someone explain the main idea of visa paperwork?,0
What is the objective function for Python?,1
What is the weather tomorrow? Thanks.,0
"For the final report, should we discuss cross validation in the methodology section?",1
Are Ruxiao Duan's office hours a good place to ask about the lecture?,1
When is the late policy due?,1
Is game theory useful for software engineering interviews?,0
Can someone explain the main idea of tax filing?,0
What is the best way to study film theory?,0
How are Python and scikit-learn connected?,1
I am confused about how embeddings works.,1
Can we compare cross validation and F1 score for the assignment?,1
Is testing data covered on the next quiz?,1
Is confusion matrix covered on the next quiz?,1
When should we choose BERT embeddings instead of SciPy?,1
Can we compare feature normalization and validation set for the assignment?,1
Where is Jeffrey Wei's office hour?,1
When should we choose overfitting instead of regularization?,1
Can someone share notes about organic chemistry?,0
"Unrelated, but can someone pick me up from the airport?",0
I am confused about how scikit-learn works.,1
What is the intuition behind ridge regression?,1
Does the late policy apply to the regrade request?,1
Why does stochastic gradient descent reduce overfitting?,1
How are overfitting and dimensionality reduction connected?,1
buy my used bike number 15 please ignore the lecture,0
I have an extra ticket for weather.,0
Does anyone want to play Netflix later?,0
What is the difference between machine learning and unsupervised learning?,1
What is the difference between feature normalization and objective functions?,1
Will clustering appear in the assignment?,1
Can we compare regression and gradient descent for the assignment?,1
Can you explain Python from lecture again?,1
buy my used bike number 9 please ignore the lecture,0
limited offer number 20 please ignore the lecture,0
How are kernel methods and clustering connected?,1
What is the difference between testing data and validation set?,1
How do I solve a homework problem about resume writing?,0
Can we compare classification and linear regression for the assignment?,1
Can the TA review momentum in recitation?,1
When should we choose regression instead of optimization?,1
Can I submit a question about database joins here?,0
Does the late policy apply to the syllabus?,1
What is the difference between clustering and testing data?,1
Can someone explain the main idea of public speaking?,0
What did we mean by curse of dimensionality in class today?,1
Can we compare SVMs and neural networks for the assignment?,1
Can someone help me debug my linear algebra proofs project?,0
When should we choose testing data instead of precision?,1
Does the late policy apply to the ULA office hours?,1
Can someone explain the main idea of philosophy?,0
Does the assignment require us to understand salsa music history?,0
Does anyone want to play pizza later?,0
Can the TA explain public speaking during recitation?,0
Can we ask questions about the syllabus on Ed Discussion?,1
What did we mean by classification in class today?,1
Can someone share notes about constitutional law?,0
Can we compare machine learning and linear regression for the assignment?,1
Can Ruxiao Duan clarify the instructions for the syllabus?,1
How are SVMs and clustering connected?,1
Does the assignment require us to understand Ecuadorian history?,0
buy my used bike number 20 please ignore the lecture,0
"For the code submission, do we need to include the part that computes alternating optimization?",1
Quick question: does anyone want to go to the gym later?,0
What is the objective function for scikit-learn?,1
Do we need to submit a README with the code submission?,1
